<?xml version="1.0" encoding="UTF-8"?>
<download-response xmlns="http://www.thrustcurve.org/2020/DownloadResponse" xmlns:xsi="http://www.w3.org/2001/XMLSchema-instance" xsi:schemaLocation="http://www.thrustcurve.org/2020/DownloadResponse http://www.thrustcurve.org/2020/download-response.xsd">
    <results>
        <result>
            <motor-id>56a40928000231000000012d</motor-id>
            <simfile-id>56a409280002e900000003c2</simfile-id>
            <format>RockSim</format>
            <source>user</source>
            <license></license>
            <data>PGVuZ2luZS1kYXRhYmFzZT4KIDxlbmdpbmUtbGlzdD4KPGVuZ2luZSBGRGl2PSIxMCIgRkZpeD0iMSIgRlN0ZXA9Ii0xLiIgSXNwPSIxNjkuOTgiIEl0b3Q9IjEzNzguNTgiIFR5cGU9InJlbG9hZGFibGUiIGF1dG8tY2FsYy1jZz0iMSIgYXV0by1jYWxjLW1hc3M9IjEiIGF2Z1RocnVzdD0iMTc4LjY4OCIgYnVybi10aW1lPSI3LjcxIiBjZ0Rpdj0iMTAiIGNnRml4PSIxIiBjZ1N0ZXA9Ii0xLiIgY29kZT0iSzE4NVciIGRlbGF5cz0iMTAwMCIgZGlhPSI1NC4iIGV4aXREaWE9IjAuIiBpbml0V3Q9IjE0MzQuMDUiIGxlbj0iNDM3LiIgbURpdj0iMTAiIG1GaXg9IjEiIG1TdGVwPSItMS4iIG1hc3NGcmFjPSI1Ny42NyIgbWZnPSJBZXJvdGVjaCIgcGVha1RocnVzdD0iMzM5LjY3NyIgcHJvcFd0PSI4MjcuMDA4IiB0RGl2PSIxMCIgdEZpeD0iMSIgdFN0ZXA9Ii0xLiIgdGhyb2F0RGlhPSIwLiI+Cjxjb21tZW50cz5BZXJvVGVjaCBLMTg1VwpDb3B5cmlnaHQgVHJpcG9saSBNb3RvciBUZXN0aW5nIDE5OTggKHd3dy50cmlwb2xpLm9yZykKcHJvdmlkZWQgYnkgVGhydXN0Q3VydmUub3JnICh3d3cudGhydXN0Y3VydmUub3JnKQo8L2NvbW1lbnRzPgo8ZGF0YT4KPGVuZy1kYXRhIGNnPSIyMTguNSIgZj0iMC4iIG09IjgyNy4wMDgiIHQ9IjAuIi8+CjxlbmctZGF0YSBjZz0iMjE4LjUiIGY9IjI3OS4xMjgiIG09IjgxNC40NDkiIHQ9IjAuMTUiLz4KPGVuZy1kYXRhIGNnPSIyMTguNSIgZj0iMzA4LjIyIiBtPSI3NjEuMjQ1IiB0PSIwLjQ1MiIvPgo8ZW5nLWRhdGEgY2c9IjIxOC41IiBmPSIzMjguNDM1IiBtPSI3MDMuNTczIiB0PSIwLjc1NCIvPgo8ZW5nLWRhdGEgY2c9IjIxOC41IiBmPSIzMzguOTI5IiBtPSI2NDMuMTIiIHQ9IjEuMDU2Ii8+CjxlbmctZGF0YSBjZz0iMjE4LjUiIGY9IjMzOS42NzciIG09IjU4MS40NDUiIHQ9IjEuMzU5Ii8+CjxlbmctZGF0YSBjZz0iMjE4LjUiIGY9IjMzMy4xNjYiIG09IjUyMC4wOTMiIHQ9IjEuNjYzIi8+CjxlbmctZGF0YSBjZz0iMjE4LjUiIGY9IjMyMS44OTEiIG09IjQ2MC43NTQiIHQ9IjEuOTY1Ii8+CjxlbmctZGF0YSBjZz0iMjE4LjUiIGY9IjMwOS42ODciIG09IjQwMy41NDMiIHQ9IjIuMjY3Ii8+CjxlbmctZGF0YSBjZz0iMjE4LjUiIGY9IjI5My4yNiIgbT0iMzQ4Ljc0NCIgdD0iMi41NyIvPgo8ZW5nLWRhdGEgY2c9IjIxOC41IiBmPSIyNzEuNTM2IiBtPSIyOTcuNDEzIiB0PSIyLjg3MyIvPgo8ZW5nLWRhdGEgY2c9IjIxOC41IiBmPSIyNDcuMTc0IiBtPSIyNTAuNDI2IiB0PSIzLjE3NSIvPgo8ZW5nLWRhdGEgY2c9IjIxOC41IiBmPSIyMTYuODgzIiBtPSIyMDguMzg5IiB0PSIzLjQ3NyIvPgo8ZW5nLWRhdGEgY2c9IjIxOC41IiBmPSIxODYuOTUxIiBtPSIxNzEuNjg3IiB0PSIzLjc4Ii8+CjxlbmctZGF0YSBjZz0iMjE4LjUiIGY9IjE2MS4wOTYiIG09IjE0MC4wNTUiIHQ9IjQuMDgzIi8+CjxlbmctZGF0YSBjZz0iMjE4LjUiIGY9IjEzOC4xMTMiIG09IjExMi45NTEiIHQ9IjQuMzg1Ii8+CjxlbmctZGF0YSBjZz0iMjE4LjUiIGY9IjExNy43NDkiIG09Ijg5LjY5NzIiIHQ9IjQuNjg4Ii8+CjxlbmctZGF0YSBjZz0iMjE4LjUiIGY9Ijk5LjM3MiIgbT0iNjkuOTY0MyIgdD0iNC45OTEiLz4KPGVuZy1kYXRhIGNnPSIyMTguNSIgZj0iODIuNzU5IiBtPSI1My40MTEzIiB0PSI1LjI5NCIvPgo8ZW5nLWRhdGEgY2c9IjIxOC41IiBmPSI2OC40MjYiIG09IjM5LjcxNjMiIHQ9IjUuNTk2Ii8+CjxlbmctZGF0YSBjZz0iMjE4LjUiIGY9IjU1LjEyNiIgbT0iMjguNTI0NCIgdD0iNS44OTgiLz4KPGVuZy1kYXRhIGNnPSIyMTguNSIgZj0iNDQuMTYyIiBtPSIxOS41MDA2IiB0PSI2LjIwMSIvPgo8ZW5nLWRhdGEgY2c9IjIxOC41IiBmPSIzNC4yMDkiIG09IjEyLjM3NzkiIHQ9IjYuNTA0Ii8+CjxlbmctZGF0YSBjZz0iMjE4LjUiIGY9IjI1LjA2NCIgbT0iNy4wMDg2NiIgdD0iNi44MDYiLz4KPGVuZy1kYXRhIGNnPSIyMTguNSIgZj0iMTYuODgiIG09IjMuMjA5MTciIHQ9IjcuMTA4Ii8+CjxlbmctZGF0YSBjZz0iMjE4LjUiIGY9IjkuMiIgbT0iMC44Mzg4OTkiIHQ9IjcuNDExIi8+CjxlbmctZGF0YSBjZz0iMjE4LjUiIGY9IjAuIiBtPSIwLiIgdD0iNy43MTUiLz4KPC9kYXRhPgo8L2VuZ2luZT4KIDwvZW5naW5lLWxpc3Q+CjwvZW5naW5lLWRhdGFiYXNlPg==</data>
            <info-url>/simfiles/56a409280002e900000003c2/</info-url>
            <data-url>/simfiles/56a409280002e900000003c2/download/data.rse</data-url>
        </result>
        <result>
            <motor-id>56a409280002310000000146</motor-id>
            <simfile-id>56a409280002e900000003c5</simfile-id>
            <format>RockSim</format>
            <source>user</source>
            <license></license>
            <data>PGVuZ2luZS1kYXRhYmFzZT4KIDxlbmdpbmUtbGlzdD4KPGVuZ2luZSBGRGl2PSIxMCIgRkZpeD0iMSIgRlN0ZXA9Ii0xLiIgSXNwPSIxODQuNjgiIEl0b3Q9IjE1OTQuNDYiIFR5cGU9InJlbG9hZGFibGUiIGF1dG8tY2FsYy1jZz0iMSIgYXV0by1jYWxjLW1hc3M9IjEiIGF2Z1RocnVzdD0iNDU1LjU2MSIgYnVybi10aW1lPSIzLjUiIGNnRGl2PSIxMCIgY2dGaXg9IjEiIGNnU3RlcD0iLTEuIiBjb2RlPSJLNTUwVyIgZGVsYXlzPSI2LDEwLDE0LDE4IiBkaWE9IjU0LiIgZXhpdERpYT0iMC4iIGluaXRXdD0iMTUxNS4xIiBsZW49IjQxMC4iIG1EaXY9IjEwIiBtRml4PSIxIiBtU3RlcD0iLTEuIiBtYXNzRnJhYz0iNTguMTEiIG1mZz0iQWVyb3RlY2giIHBlYWtUaHJ1c3Q9Ijg1My4xMyIgcHJvcFd0PSI4ODAuNCIgdERpdj0iMTAiIHRGaXg9IjEiIHRTdGVwPSItMS4iIHRocm9hdERpYT0iMC4iPgo8ZGF0YT4KPGVuZy1kYXRhIGNnPSIyMDUuIiBmPSIwLiIgbT0iODgwLjQiIHQ9IjAuIi8+CjxlbmctZGF0YSBjZz0iMjA1LiIgZj0iNjI4LjE1IiBtPSI4ODAuNCIgdD0iMC4iLz4KPGVuZy1kYXRhIGNnPSIyMDUuIiBmPSI4NTMuMTMiIG09IjgzOS41MDUiIHQ9IjAuMSIvPgo8ZW5nLWRhdGEgY2c9IjIwNS4iIGY9IjY5NS45OCIgbT0iNzk2LjczNyIgdD0iMC4yIi8+CjxlbmctZGF0YSBjZz0iMjA1LiIgZj0iNjI4LjY0IiBtPSI3NjAuMTY3IiB0PSIwLjMiLz4KPGVuZy1kYXRhIGNnPSIyMDUuIiBmPSI2MDYuMTciIG09IjYyMy44MDQiIHQ9IjAuNyIvPgo8ZW5nLWRhdGEgY2c9IjIwNS4iIGY9IjYwNi4xNyIgbT0iNDU2LjQ1MiIgdD0iMS4yIi8+CjxlbmctZGF0YSBjZz0iMjA1LiIgZj0iNTg4LjIiIG09IjMyNC41NTUiIHQ9IjEuNiIvPgo8ZW5nLWRhdGEgY2c9IjIwNS4iIGY9IjU0My4zMiIgbT0iMjYyLjA3NyIgdD0iMS44Ii8+CjxlbmctZGF0YSBjZz0iMjA1LiIgZj0iNDM1LjU1IiBtPSI3Mi45MDQ2IiB0PSIyLjUiLz4KPGVuZy1kYXRhIGNnPSIyMDUuIiBmPSI4OS44NSIgbT0iMTQuODgzNSIgdD0iMi45Ii8+CjxlbmctZGF0YSBjZz0iMjA1LiIgZj0iMC4iIG09IjAuIiB0PSIzLjUiLz4KPC9kYXRhPgo8L2VuZ2luZT4KIDwvZW5naW5lLWxpc3Q+CjwvZW5naW5lLWRhdGFiYXNlPg==</data>
            <info-url>/simfiles/56a409280002e900000003c5/</info-url>
            <data-url>/simfiles/56a409280002e900000003c5/download/data.rse</data-url>
        </result>
        <result>
            <motor-id>56a40928000231000000012d</motor-id>
            <simfile-id>56a409280002e90000000069</simfile-id>
            <format>RASP</format>
            <source>cert</source>
            <license>PD</license>
            <data>OyBBZXJvVGVjaCBLMTg1Vwo7IGNvbnZlcnRlZCBmcm9tIFRNVCB0ZXN0IHN0YW5kIGRhdGEgMTk5OCAod3d3LnRyaXBvbGkub3JnKQo7IHByb3ZpZGVkIGJ5IFRocnVzdEN1cnZlLm9yZyAod3d3LnRocnVzdGN1cnZlLm9yZykKSzE4NVcgNTQgNDM3IDAgMC44MjcwMDggMS40MzQwNSBBVAogICAwLjE1MCAyNzkuMTI4CiAgIDAuNDUyIDMwOC4yMjAKICAgMC43NTQgMzI4LjQzNQogICAxLjA1NiAzMzguOTI5CiAgIDEuMzU5IDMzOS42NzcKICAgMS42NjMgMzMzLjE2NgogICAxLjk2NSAzMjEuODkxCiAgIDIuMjY3IDMwOS42ODcKICAgMi41NzAgMjkzLjI2MAogICAyLjg3MyAyNzEuNTM2CiAgIDMuMTc1IDI0Ny4xNzQKICAgMy40NzcgMjE2Ljg4MwogICAzLjc4MCAxODYuOTUxCiAgIDQuMDgzIDE2MS4wOTYKICAgNC4zODUgMTM4LjExMwogICA0LjY4OCAxMTcuNzQ5CiAgIDQuOTkxIDk5LjM3MgogICA1LjI5NCA4Mi43NTkKICAgNS41OTYgNjguNDI2CiAgIDUuODk4IDU1LjEyNgogICA2LjIwMSA0NC4xNjIKICAgNi41MDQgMzQuMjA5CiAgIDYuODA2IDI1LjA2NAogICA3LjEwOCAxNi44ODAKICAgNy40MTEgOS4yMDAKICAgNy43MTUgMC4wMDA=</data>
            <info-url>/simfiles/56a409280002e90000000069/</info-url>
            <data-url>/simfiles/56a409280002e90000000069/download/data.eng</data-url>
        </result>
        <result>
            <motor-id>56a409280002310000000146</motor-id>
            <simfile-id>56a409280002e90000000071</simfile-id>
            <format>RASP</format>
            <source>cert</source>
            <license>PD</license>
            <data>OyBBZXJvVGVjaCBLNTUwVwo7IGNvbnZlcnRlZCBmcm9tIFRNVCB0ZXN0IHN0YW5kIGRhdGEgMTk5OCAod3d3LnRyaXBvbGkub3JnKQo7IHByb3ZpZGVkIGJ5IFRocnVzdEN1cnZlLm9yZyAod3d3LnRocnVzdGN1cnZlLm9yZykKSzU1MFcgNTQgNDEwIDAgMC45MTk3NDQgMS40ODczNiBBVAogICAwLjA2NSA2MDQuMjY0CiAgIDAuMTk2IDY0Mi42MjUKICAgMC4zMjcgNjgyLjE5NwogICAwLjQ1OCA3MzIuOTk1CiAgIDAuNTkxIDc1OC4yMzYKICAgMC43MjMgNzgwLjI4OQogICAwLjg1NCA3OTQuNDUyCiAgIDAuOTg1IDc5Ny45MzkKICAgMS4xMTcgNzk3LjYwMQogICAxLjI0OSA3NzMuODQyCiAgIDEuMzgxIDcxMS42MDgKICAgMS41MTIgNjQ2LjUyMgogICAxLjY0NCA1OTAuNzI0CiAgIDEuNzc1IDUzNy41MDUKICAgMS45MDcgNDkxLjAxMgogICAyLjA0MCA0NDUuODM2CiAgIDIuMTcxIDQwMS40NjEKICAgMi4zMDIgMzY0LjI5MQogICAyLjQzMyAzMTkuNjE0CiAgIDIuNTY2IDI1NS41NzcKICAgMi42OTggMTcyLjU3MwogICAyLjgyOSAxMDMuNTAxCiAgIDIuOTYwIDUxLjc5NQogICAzLjA5MiAyNi44MTQKICAgMy4yMjQgMTUuMjAzCiAgIDMuMzU2IDAuMDAw</data>
            <info-url>/simfiles/56a409280002e90000000071/</info-url>
            <data-url>/simfiles/56a409280002e90000000071/download/data.eng</data-url>
        </result>
    </results>
</download-response>