<?xml version="1.0" encoding="UTF-8"?>
<download-response xmlns="http://www.thrustcurve.org/2014/DownloadResponse" xmlns:xsi="http://www.w3.org/2001/XMLSchema-instance" xsi:schemaLocation="http://www.thrustcurve.org/2014/DownloadResponse http://www.thrustcurve.org/2014/download-response.xsd">
    <results>
        <result>
            <motor-id>326</motor-id>
            <simfile-id>965</simfile-id>
            <format>RockSim</format>
            <source>user</source>
            <license></license>
            <data>PGVuZ2luZS1kYXRhYmFzZT4KIDxlbmdpbmUtbGlzdD4KPGVuZ2luZSBGRGl2PSIxMCIgRkZpeD0iMSIgRlN0ZXA9Ii0xLiIgSXNwPSIxODQuNjgiIEl0b3Q9IjE1OTQuNDYiIFR5cGU9InJlbG9hZGFibGUiIGF1dG8tY2FsYy1jZz0iMSIgYXV0by1jYWxjLW1hc3M9IjEiIGF2Z1RocnVzdD0iNDU1LjU2MSIgYnVybi10aW1lPSIzLjUiIGNnRGl2PSIxMCIgY2dGaXg9IjEiIGNnU3RlcD0iLTEuIiBjb2RlPSJLNTUwVyIgZGVsYXlzPSI2LDEwLDE0LDE4IiBkaWE9IjU0LiIgZXhpdERpYT0iMC4iIGluaXRXdD0iMTUxNS4xIiBsZW49IjQxMC4iIG1EaXY9IjEwIiBtRml4PSIxIiBtU3RlcD0iLTEuIiBtYXNzRnJhYz0iNTguMTEiIG1mZz0iQWVyb3RlY2giIHBlYWtUaHJ1c3Q9Ijg1My4xMyIgcHJvcFd0PSI4ODAuNCIgdERpdj0iMTAiIHRGaXg9IjEiIHRTdGVwPSItMS4iIHRocm9hdERpYT0iMC4iPgo8ZGF0YT4KPGVuZy1kYXRhIGNnPSIyMDUuIiBmPSIwLiIgbT0iODgwLjQiIHQ9IjAuIi8+CjxlbmctZGF0YSBjZz0iMjA1LiIgZj0iNjI4LjE1IiBtPSI4ODAuNCIgdD0iMC4iLz4KPGVuZy1kYXRhIGNnPSIyMDUuIiBmPSI4NTMuMTMiIG09IjgzOS41MDUiIHQ9IjAuMSIvPgo8ZW5nLWRhdGEgY2c9IjIwNS4iIGY9IjY5NS45OCIgbT0iNzk2LjczNyIgdD0iMC4yIi8+CjxlbmctZGF0YSBjZz0iMjA1LiIgZj0iNjI4LjY0IiBtPSI3NjAuMTY3IiB0PSIwLjMiLz4KPGVuZy1kYXRhIGNnPSIyMDUuIiBmPSI2MDYuMTciIG09IjYyMy44MDQiIHQ9IjAuNyIvPgo8ZW5nLWRhdGEgY2c9IjIwNS4iIGY9IjYwNi4xNyIgbT0iNDU2LjQ1MiIgdD0iMS4yIi8+CjxlbmctZGF0YSBjZz0iMjA1LiIgZj0iNTg4LjIiIG09IjMyNC41NTUiIHQ9IjEuNiIvPgo8ZW5nLWRhdGEgY2c9IjIwNS4iIGY9IjU0My4zMiIgbT0iMjYyLjA3NyIgdD0iMS44Ii8+CjxlbmctZGF0YSBjZz0iMjA1LiIgZj0iNDM1LjU1IiBtPSI3Mi45MDQ2IiB0PSIyLjUiLz4KPGVuZy1kYXRhIGNnPSIyMDUuIiBmPSI4OS44NSIgbT0iMTQuODgzNSIgdD0iMi45Ii8+CjxlbmctZGF0YSBjZz0iMjA1LiIgZj0iMC4iIG09IjAuIiB0PSIzLjUiLz4KPC9kYXRhPgo8L2VuZ2luZT4KIDwvZW5naW5lLWxpc3Q+CjwvZW5naW5lLWRhdGFiYXNlPg==</data>
            <info-url>/simfiles/56a409280002e900000003c5/</info-url>
            <data-url>/simfiles/56a409280002e900000003c5/download/data.rse</data-url>
        </result>
        <result>
            <motor-id>326</motor-id>
            <simfile-id>113</simfile-id>
            <format>RASP</format>
            <source>cert</source>
            <license>PD</license>
            <data>OyBBZXJvVGVjaCBLNTUwVwo7IGNvbnZlcnRlZCBmcm9tIFRNVCB0ZXN0IHN0YW5kIGRhdGEgMTk5OCAod3d3LnRyaXBvbGkub3JnKQo7IHByb3ZpZGVkIGJ5IFRocnVzdEN1cnZlLm9yZyAod3d3LnRocnVzdGN1cnZlLm9yZykKSzU1MFcgNTQgNDEwIDAgMC45MTk3NDQgMS40ODczNiBBVAogICAwLjA2NSA2MDQuMjY0CiAgIDAuMTk2IDY0Mi42MjUKICAgMC4zMjcgNjgyLjE5NwogICAwLjQ1OCA3MzIuOTk1CiAgIDAuNTkxIDc1OC4yMzYKICAgMC43MjMgNzgwLjI4OQogICAwLjg1NCA3OTQuNDUyCiAgIDAuOTg1IDc5Ny45MzkKICAgMS4xMTcgNzk3LjYwMQogICAxLjI0OSA3NzMuODQyCiAgIDEuMzgxIDcxMS42MDgKICAgMS41MTIgNjQ2LjUyMgogICAxLjY0NCA1OTAuNzI0CiAgIDEuNzc1IDUzNy41MDUKICAgMS45MDcgNDkxLjAxMgogICAyLjA0MCA0NDUuODM2CiAgIDIuMTcxIDQwMS40NjEKICAgMi4zMDIgMzY0LjI5MQogICAyLjQzMyAzMTkuNjE0CiAgIDIuNTY2IDI1NS41NzcKICAgMi42OTggMTcyLjU3MwogICAyLjgyOSAxMDMuNTAxCiAgIDIuOTYwIDUxLjc5NQogICAzLjA5MiAyNi44MTQKICAgMy4yMjQgMTUuMjAzCiAgIDMuMzU2IDAuMDAw</data>
            <info-url>/simfiles/56a409280002e90000000071/</info-url>
            <data-url>/simfiles/56a409280002e90000000071/download/data.eng</data-url>
        </result>
    </results>
</download-response>